رقم المورد,اسم المورد,رقم حساب المورد,المدينه,الهاتف,الجوال,التوقيف,تاريخ التعامل,الرقم الضريبي,السجل التجاري,الارشفه,الرصيد
2201300,شركة الشهرانى العالمية المحدودة,2111010001,,,,,,,,غير مؤرشف,0
2201301,مؤسسة ماسة المعالى التجارية,2111010001,,,,,,,,غير مؤرشف,0
2201302,مؤسسة خبراء التوزيع التجارية,2111010001,,,580437910,,,3.00021E+14,,غير مؤرشف,54.56
2201303,MERCARIEX WORLDWIDE,2111010001,,,,,,,,غير مؤرشف,0
2201304,مؤسسة شلال الغذاء للتجارة- الرياض,2111010001,,,558279474,,,3.11281E+14,,غير مؤرشف,4071.75
2201305,شركة شامل الغذاء للتجارة المستودعات,2111010001,,,537330328,,,3.12626E+14,,غير مؤرشف,78.2
2201306,SAMEX INDIA PVT . LTD,2111010001,,,,,,,,غير مؤرشف,648082.5
2201307,مؤسسة صمود الماضى لتجارة الجملة,2111010001,,,,,,3.02238E+14,,غير مؤرشف,
2201308,مصنع خلطة الغربي للصناعة موقف *************220100680,2111010001,,,563530944,,,3.10838E+14,,غير مؤرشف,138
2201309,مؤسسة ماجد احمد يحيى عواجى,2111010001,,,,,,3.10199E+14,,غير مؤرشف,
2201310,مؤسسة بيت الاعشاب التجارية,2111010001,,,,,,3.00124E+14,,غير مؤرشف,
2201311,موسسه منير محمد احمد الجهني للتجاره,2111010001,,556180417,,,,3.11149E+14,,غير مؤرشف,50790
2201312,مؤسسة عالم المكسرات,2111010001,,,,,,3.00687E+14,,غير مؤرشف,0
2201313,شركة شهاب الوطن التجارية المحدودة,2111010001,,,552009813,,,3.11948E+14,,غير مؤرشف,111500
2201314,PRATA PERERIRA IMPORTACAO,2111010001,,,,,,,,غير مؤرشف,0
2201315,CV. BUMI BERKAT,2111010001,,,,,,,,غير مؤرشف,0
2201316,ASIAN FOOD INDUSTRIES - INDIA,2111010001,,,,,,,,غير مؤرشف,0
2201317,مؤسسة هناء سالمين باصالح التجارية,2111010001,,,544347188,,,3.00493E+14,,غير مؤرشف,0
2201318,ORIENT EXPORT,2111010001,,,,,,,,غير مؤرشف,0
2201319,شركة الرؤى للمواد الغذائية,2111010001,,,504264486,,,3.105E+14,,غير مؤرشف,91868.05
2201319,شركة الرؤى للمواد الغذائية,2111010001,,,504264486,,,3.105E+14,,غير مؤرشف,91868.05
2201320,WUHAN DONGTIANHENG TRADING CO - CHINA,2111010001,,,,,,,,غير مؤرشف,0
2201321,مؤسسة مملكة اللبان التجارية- الرياض,2111010001,,,,,,3.02176E+14,,غير مؤرشف,0
2201322,مؤسسة سلة التوابل-التعمير\موقف\,2111010001,,,549991939,,,3.02237E+14,,غير مؤرشف,0
2201323,ABDULWASI AHMED IMPORT AND EXPORT,2111010001,,,,,,,,غير مؤرشف,0
2201324,MILLIYON JEMAL COFFEE EXPORT - ETHIOPIA,2111010001,,,,,,,,غير مؤرشف,0
2201325,مؤسسة سالم عبد الله الزمام التجارية- عرعر,2111010001,,,,,,3.1021E+14,,غير مؤرشف,0
2201326,مؤسسة روافد البن التجارية,2111010001,,,530322263,,,3.00886E+14,,غير مؤرشف,101288
2201327,مؤسسة احمد عبد الله بن خميس للتجارة,2111010001,,,,,,3.00069E+14,,غير مؤرشف,
2201328,شركه جنان الزيتون الرياض // محول لحساب البيت الدمشقي,2111010001,,,507851774,موقف,,3.11316E+14,,غير مؤرشف,0
2201329,مؤسسة درة البرارى للتجارة,2111010001,,,,,,3.00253E+14,,غير مؤرشف,
2201330,مؤسسة بيت الوناسة للتجارة,2111010001,,,,,,3.10282E+14,,غير مؤرشف,
2201331,شركة الجوف للتنمية الزراعية,2111010001,,,505472659,,,3.00001E+14,,غير مؤرشف,146908.69
2201332,مؤسسة درة الصالحية لتجارة المواد اللغذائية - الرياض,2111010001,,,,,,3.00453E+14,,غير مؤرشف,
2201333,مؤسسة المرزوقى للبخور و اللبان,2111010001,,,,,,3.00951E+14,,غير مؤرشف,0.02
2201334,شركة مصنع قطوف الوادي,2111010001,,,568441168,,,3.0095E+14,,غير مؤرشف,38853.9
2201335,شركة قهوة السيف للتجارة - الرياض,2111010001,,,560526674,,,3.10188E+14,,غير مؤرشف,129529.17
2201336,مؤسسة مزاج كيف القهوة للتجارة - الرياض,2111010001,,,541299976,,,3.02135E+14,,غير مؤرشف,70630.06
2201337,و,2111010001,,,,موقف,,3.10276E+14,,غير مؤرشف,0
2201338, شركة سماء الكيف للتجارة,2111010001,,,,,,3.11649E+14,,غير مؤرشف,2.45
2201339,ج,2111010001,,,,موقف,,3.02222E+14,,غير مؤرشف,0
2201340,شركة محمد وابراهيم على المنيعى للتجارة- القصيم,2111010001,,,,,,3.00526E+14,,غير مؤرشف,
2201350,مؤسسه رمال الرجبه للتجاره - الرياض,2111010001,,,,,,3.10669E+14,,غير مؤرشف,4786.41
2201351,VADAKKEDATH INDUSTRIES,2111010001,,,,,,,,غير مؤرشف,0
2201352,ض,2111010001,,,,موقف,,3.10384E+13,,غير مؤرشف,
2201353,شركة ارض الفردوس للتجارة,2111010001,,,537712307,,,3.11307E+14,,غير مؤرشف,749392.12
2201354,مؤسسة هذال رشيد العتيبي,2111010001,,,531367013,,,3.00475E+14,,غير مؤرشف,5751.19
2201355,شركة وادي حلفا للتجارة,2111010001,,594215013,,,,3.10943E+14,,غير مؤرشف,5.84
2201356,مؤسسة شاي تلقيمة للتجارة,2111010001,,,,,,3.1096E+14,,غير مؤرشف,4030
2201357,مؤسسة الحناكي للتجارة,2111010001,,,,,,3.0004E+14,,غير مؤرشف,
23,ا,2111010001,,,,موقف,,1,,غير مؤرشف,0
24,مؤسسة الكويت التجارية,2111010001,,,,,,,,غير مؤرشف,
25,شركة مرج الشام التجارية المحدوده,2111010001,,506958888,,,,3.00716E+14,,غير مؤرشف,0.11
26,مؤسسة محمد بن سالم المري للتجارة,2111010001,,,,,,3.02041E+14,480,مؤرشف,
28,مؤسسة سالم عبدالله البراك للتجارة,2111010001,,,597751667,,,3.02253E+14,,غير مؤرشف,142599.25
3,جناح كيف الشيوخ عتيقة,2111010001,,,,,,,,غير مؤرشف,0
4,-,2111010001,,,,موقف,,,,غير مؤرشف,0
5,--,2111010001,,,,موقف,,3.00453E+14,,غير مؤرشف,0
6,شركة بنتي للصناعة - معمول,2111010001,,547032238,,,,3.10876E+14,,غير مؤرشف,3.41
7,موقف,2111010001,,,500000742,,,,,غير مؤرشف,0
8,مؤسسة اصايل الغذاء  للتجارة,2111010001,,,550958238,,,3.10015E+14,,غير مؤرشف,352074.31
9,مصنع قطار الخليج للبلاستيك,2111010001,,,580774868,,,,,غير مؤرشف,35690.29
9,مصنع قطار الخليج للبلاستيك,2111010001,,,580774868,,,,,غير مؤرشف,35690.29
